{
  "generatedAt": "2026-03-16T20:58:23.033Z",
  "sourceFiles": [
    "content/source/publishing-library.authoritative.json",
    "js/routes.js"
  ],
  "counts": {
    "sagas": 1,
    "series": 1,
    "books": 3
  },
  "sagas": [
    {
      "id": "the-god-story-saga",
      "title": "The God Story Saga",
      "canonicalPath": "/publishing/sagas/the-god-story-saga/",
      "description": "A wider story world carrying the spiritual, symbolic, and long-form side of Triad of Angels through ToA Studios publishing.",
      "art": {
        "wide": "/assets/images/books/the-god-story-saga/hero-wide.webp"
      },
      "storeRegions": [
        "AU",
        "US",
        "UK",
        "CA",
        "DE",
        "FR",
        "ES",
        "IT",
        "JP",
        "IN",
        "NL",
        "SE"
      ]
    }
  ],
  "series": [
    {
      "id": "unseen-age",
      "sagaId": "the-god-story-saga",
      "title": "The Unseen Age",
      "canonicalPath": "/publishing/series/unseen-age/",
      "description": "A series set within The God Story Saga, following the fracture between innocence, rebellion, consequence, and what rises from the unseen world around them."
    }
  ],
  "books": [
    {
      "id": "unseen-age-v1-before-breath",
      "sagaId": "the-god-story-saga",
      "seriesId": "unseen-age",
      "title": "Before Breath",
      "subtitle": "The Unseen Age — Volume I",
      "canonicalPath": "/publishing/books/unseen-age-v1-before-breath/",
      "cover": "",
      "approxTimestamp": 0,
      "stores": {
        "amazonRegional": {
          "AU": "https://www.amazon.com.au/dp/B0GPWC4527",
          "US": "https://www.amazon.com/dp/B0GPWC4527",
          "UK": "https://www.amazon.co.uk/dp/B0GPWC4527",
          "CA": "https://www.amazon.ca/dp/B0GPWC4527",
          "DE": "https://www.amazon.de/dp/B0GPWC4527",
          "FR": "https://www.amazon.fr/dp/B0GPWC4527",
          "ES": "https://www.amazon.es/dp/B0GPWC4527",
          "IT": "https://www.amazon.it/dp/B0GPWC4527",
          "JP": "https://www.amazon.co.jp/dp/B0GPWC4527",
          "IN": "https://www.amazon.in/dp/B0GPWC4527",
          "NL": "https://www.amazon.nl/dp/B0GPWC4527",
          "SE": "https://www.amazon.se/dp/B0GPWC4527"
        }
      },
      "formats": [
        "Kindle eBook"
      ]
    },
    {
      "id": "unseen-age-v2-the-garden-and-the-fracture",
      "sagaId": "the-god-story-saga",
      "seriesId": "unseen-age",
      "title": "The Garden and the Fracture",
      "subtitle": "The Unseen Age — Volume II",
      "canonicalPath": "/publishing/books/unseen-age-v2-the-garden-and-the-fracture/",
      "cover": "",
      "approxTimestamp": 0,
      "stores": {
        "amazonRegional": {
          "AU": "https://www.amazon.com.au/dp/B0GQP9FP81",
          "US": "https://www.amazon.com/dp/B0GQP9FP81",
          "UK": "https://www.amazon.co.uk/dp/B0GQP9FP81",
          "CA": "https://www.amazon.ca/dp/B0GQP9FP81",
          "DE": "https://www.amazon.de/dp/B0GQP9FP81",
          "FR": "https://www.amazon.fr/dp/B0GQP9FP81",
          "ES": "https://www.amazon.es/dp/B0GQP9FP81",
          "IT": "https://www.amazon.it/dp/B0GQP9FP81",
          "JP": "https://www.amazon.co.jp/dp/B0GQP9FP81",
          "IN": "https://www.amazon.in/dp/B0GQP9FP81",
          "NL": "https://www.amazon.nl/dp/B0GQP9FP81",
          "SE": "https://www.amazon.se/dp/B0GQP9FP81"
        }
      },
      "formats": [
        "Kindle eBook"
      ]
    },
    {
      "id": "unseen-age-v3-the-watchers-descent",
      "sagaId": "the-god-story-saga",
      "seriesId": "unseen-age",
      "title": "The Watchers' Descent",
      "subtitle": "The Unseen Age — Volume III",
      "canonicalPath": "/publishing/books/unseen-age-v3-the-watchers-descent/",
      "cover": "",
      "approxTimestamp": 0,
      "stores": {
        "amazonRegional": {
          "AU": "https://www.amazon.com.au/dp/B0GR4HYXZW",
          "US": "https://www.amazon.com/dp/B0GR4HYXZW",
          "UK": "https://www.amazon.co.uk/dp/B0GR4HYXZW",
          "CA": "https://www.amazon.ca/dp/B0GR4HYXZW",
          "DE": "https://www.amazon.de/dp/B0GR4HYXZW",
          "FR": "https://www.amazon.fr/dp/B0GR4HYXZW",
          "ES": "https://www.amazon.es/dp/B0GR4HYXZW",
          "IT": "https://www.amazon.it/dp/B0GR4HYXZW",
          "JP": "https://www.amazon.co.jp/dp/B0GR4HYXZW",
          "IN": "https://www.amazon.in/dp/B0GR4HYXZW",
          "NL": "https://www.amazon.nl/dp/B0GR4HYXZW",
          "SE": "https://www.amazon.se/dp/B0GR4HYXZW"
        }
      },
      "formats": [
        "Kindle eBook"
      ]
    }
  ]
}
